{
 "schema": "check-report/1",
 "tool": "check_all.py",
 "toolVersion": "2.0.0",
 "target": {
  "path": "fallingwater-master.ifc",
  "type": "building"
 },
 "result": "pass",
 "exitCode": 0,
 "summary": {
  "requiredFailures": 0,
  "recommendedWarnings": 0,
  "passes": 12,
  "info": 6
 },
 "profile": {
  "name": "default",
  "version": "1.0.0",
  "sha256": "6389373e6bba151701c9713797efbe386569e97cf73cf3a5809d29cfa051f690"
 },
 "counts": {
  "checks": 1
 },
 "findings": [
  {
   "id": "B-04@72f853ca",
   "rule": "B-04",
   "level": "REQUIRED",
   "status": "pass",
   "severity": "pass",
   "location": {
    "file": "fallingwater-master.ifc"
   },
   "message": "ASCII only",
   "source": "check_ifc.py"
  },
  {
   "id": "B-08@95a8ac4d",
   "rule": "B-08",
   "level": "RECOMMENDED",
   "status": "pass",
   "severity": "pass",
   "location": {
    "file": "fallingwater-master.ifc"
   },
   "message": "every entity is on one line",
   "source": "check_ifc.py"
  },
  {
   "id": "B-05@22fd9db5",
   "rule": "B-05",
   "level": "REQUIRED",
   "status": "pass",
   "severity": "pass",
   "location": {
    "file": "fallingwater-master.ifc"
   },
   "message": "file size 0.1 MB",
   "source": "check_ifc.py"
  },
  {
   "id": "B-01@05525a59",
   "rule": "B-01",
   "level": "REQUIRED",
   "status": "pass",
   "severity": "pass",
   "location": {
    "file": "fallingwater-master.ifc"
   },
   "message": "schema IFC4",
   "source": "check_ifc.py"
  },
  {
   "id": "B-02@54704255",
   "rule": "B-02",
   "level": "REQUIRED",
   "status": "pass",
   "severity": "pass",
   "location": {
    "file": "fallingwater-master.ifc"
   },
   "message": "length unit is metre",
   "source": "check_ifc.py"
  },
  {
   "id": "B-70@b3f6fad0",
   "rule": "B-70",
   "level": "REQUIRED",
   "status": "pass",
   "severity": "pass",
   "location": {
    "file": "fallingwater-master.ifc"
   },
   "message": "227 GlobalId values, unique, 22 characters",
   "source": "check_ifc.py"
  },
  {
   "id": "B-71@7ff99f4e",
   "rule": "B-71",
   "level": "RECOMMENDED",
   "status": "info",
   "severity": "info",
   "location": {
    "file": "fallingwater-master.ifc"
   },
   "message": "lowest entity number is #1 (the profile assigns no start)",
   "source": "check_ifc.py"
  },
  {
   "id": "B-72@e9aa8018",
   "rule": "B-72",
   "level": "RECOMMENDED",
   "status": "pass",
   "severity": "pass",
   "location": {
    "file": "fallingwater-master.ifc"
   },
   "message": "all declaration properties are single values",
   "source": "check_ifc.py"
  },
  {
   "id": "B-13@c209249d",
   "rule": "B-13",
   "level": "REQUIRED",
   "status": "pass",
   "severity": "pass",
   "location": {
    "file": "fallingwater-master.ifc"
   },
   "message": "3 level(s); every element belongs to a level",
   "source": "check_ifc.py"
  },
  {
   "id": "B-06@950be627",
   "rule": "B-06",
   "level": "REQUIRED",
   "status": "pass",
   "severity": "pass",
   "location": {
    "file": "fallingwater-master.ifc"
   },
   "message": "every represented product yields triangles",
   "source": "check_ifc.py"
  },
  {
   "id": "B-05@ae8ed1b4",
   "rule": "B-05",
   "level": "REQUIRED",
   "status": "pass",
   "severity": "pass",
   "location": {
    "file": "fallingwater-master.ifc"
   },
   "message": "1382 vertices, 2396 triangles",
   "source": "check_ifc.py"
  },
  {
   "id": "B-22@cfb8e99f",
   "rule": "B-22",
   "level": "REQUIRED",
   "status": "pass",
   "severity": "pass",
   "location": {
    "file": "fallingwater-master.ifc"
   },
   "message": "10 room(s), RoomId values unique in this file",
   "source": "check_ifc.py"
  },
  {
   "id": "B-33@fe25d900",
   "rule": "B-33",
   "level": "REQUIRED",
   "status": "info",
   "severity": "info",
   "location": {
    "file": "fallingwater-master.ifc"
   },
   "message": "walkability extension not enabled by the profile; standing points were not checked",
   "source": "check_ifc.py"
  },
  {
   "id": "B-41@b0129f74",
   "rule": "B-41",
   "level": "REQUIRED",
   "status": "pass",
   "severity": "pass",
   "location": {
    "file": "fallingwater-master.ifc"
   },
   "message": "12 door(s), each fills an opening that voids a wall",
   "source": "check_ifc.py"
  },
  {
   "id": "B-90@c3bfd567",
   "rule": "B-90",
   "level": "REQUIRED",
   "status": "info",
   "severity": "info",
   "location": {
    "file": "fallingwater-master.ifc"
   },
   "message": "luminaires extension not enabled by the profile; fixtures were not checked",
   "source": "check_ifc.py"
  },
  {
   "id": "B-100@c7681184",
   "rule": "B-100",
   "level": "REQUIRED",
   "status": "info",
   "severity": "info",
   "location": {
    "file": "fallingwater-master.ifc"
   },
   "message": "signboards extension not enabled by the profile; boards were not checked",
   "source": "check_ifc.py"
  },
  {
   "id": "B-110@d10857fa",
   "rule": "B-110",
   "level": "REQUIRED",
   "status": "info",
   "severity": "info",
   "location": {
    "file": "fallingwater-master.ifc"
   },
   "message": "the profile gives no build volume; it was not checked",
   "source": "check_ifc.py"
  },
  {
   "id": "D-03@1e3a8fd2",
   "rule": "D-03",
   "level": "REQUIRED",
   "status": "info",
   "severity": "info",
   "location": {
    "file": "fallingwater-master.ifc"
   },
   "message": "9 (class, colour, opacity) combinations found; give --finish-schedule to check coverage",
   "source": "check_ifc.py"
  }
 ],
 "reports": [
  {
   "schema": "check-report/1",
   "tool": "check_ifc.py",
   "toolVersion": "2.0.0",
   "target": {
    "path": "fallingwater-master.ifc",
    "sha256": "39c83ad1817ca18623f2b6577820d22f944d761a35db26c2835332167e45d1c9"
   },
   "result": "pass",
   "exitCode": 0,
   "summary": {
    "requiredFailures": 0,
    "recommendedWarnings": 0,
    "passes": 12,
    "info": 6
   },
   "profile": {
    "name": "default",
    "version": "1.0.0",
    "sha256": "6389373e6bba151701c9713797efbe386569e97cf73cf3a5809d29cfa051f690"
   },
   "counts": {
    "levels": 3,
    "rooms": 10,
    "doors": 12,
    "windows": 19,
    "luminaires": 0,
    "triangles": 2396,
    "vertices": 1382,
    "furniture": 0,
    "finishKeys": 9
   },
   "findings": [
    {
     "id": "B-04@72f853ca",
     "rule": "B-04",
     "level": "REQUIRED",
     "status": "pass",
     "severity": "pass",
     "location": {
      "file": "fallingwater-master.ifc"
     },
     "message": "ASCII only"
    },
    {
     "id": "B-08@95a8ac4d",
     "rule": "B-08",
     "level": "RECOMMENDED",
     "status": "pass",
     "severity": "pass",
     "location": {
      "file": "fallingwater-master.ifc"
     },
     "message": "every entity is on one line"
    },
    {
     "id": "B-05@22fd9db5",
     "rule": "B-05",
     "level": "REQUIRED",
     "status": "pass",
     "severity": "pass",
     "location": {
      "file": "fallingwater-master.ifc"
     },
     "message": "file size 0.1 MB"
    },
    {
     "id": "B-01@05525a59",
     "rule": "B-01",
     "level": "REQUIRED",
     "status": "pass",
     "severity": "pass",
     "location": {
      "file": "fallingwater-master.ifc"
     },
     "message": "schema IFC4"
    },
    {
     "id": "B-02@54704255",
     "rule": "B-02",
     "level": "REQUIRED",
     "status": "pass",
     "severity": "pass",
     "location": {
      "file": "fallingwater-master.ifc"
     },
     "message": "length unit is metre"
    },
    {
     "id": "B-70@b3f6fad0",
     "rule": "B-70",
     "level": "REQUIRED",
     "status": "pass",
     "severity": "pass",
     "location": {
      "file": "fallingwater-master.ifc"
     },
     "message": "227 GlobalId values, unique, 22 characters"
    },
    {
     "id": "B-71@7ff99f4e",
     "rule": "B-71",
     "level": "RECOMMENDED",
     "status": "info",
     "severity": "info",
     "location": {
      "file": "fallingwater-master.ifc"
     },
     "message": "lowest entity number is #1 (the profile assigns no start)"
    },
    {
     "id": "B-72@e9aa8018",
     "rule": "B-72",
     "level": "RECOMMENDED",
     "status": "pass",
     "severity": "pass",
     "location": {
      "file": "fallingwater-master.ifc"
     },
     "message": "all declaration properties are single values"
    },
    {
     "id": "B-13@c209249d",
     "rule": "B-13",
     "level": "REQUIRED",
     "status": "pass",
     "severity": "pass",
     "location": {
      "file": "fallingwater-master.ifc"
     },
     "message": "3 level(s); every element belongs to a level"
    },
    {
     "id": "B-06@950be627",
     "rule": "B-06",
     "level": "REQUIRED",
     "status": "pass",
     "severity": "pass",
     "location": {
      "file": "fallingwater-master.ifc"
     },
     "message": "every represented product yields triangles"
    },
    {
     "id": "B-05@ae8ed1b4",
     "rule": "B-05",
     "level": "REQUIRED",
     "status": "pass",
     "severity": "pass",
     "location": {
      "file": "fallingwater-master.ifc"
     },
     "message": "1382 vertices, 2396 triangles"
    },
    {
     "id": "B-22@cfb8e99f",
     "rule": "B-22",
     "level": "REQUIRED",
     "status": "pass",
     "severity": "pass",
     "location": {
      "file": "fallingwater-master.ifc"
     },
     "message": "10 room(s), RoomId values unique in this file"
    },
    {
     "id": "B-33@fe25d900",
     "rule": "B-33",
     "level": "REQUIRED",
     "status": "info",
     "severity": "info",
     "location": {
      "file": "fallingwater-master.ifc"
     },
     "message": "walkability extension not enabled by the profile; standing points were not checked"
    },
    {
     "id": "B-41@b0129f74",
     "rule": "B-41",
     "level": "REQUIRED",
     "status": "pass",
     "severity": "pass",
     "location": {
      "file": "fallingwater-master.ifc"
     },
     "message": "12 door(s), each fills an opening that voids a wall"
    },
    {
     "id": "B-90@c3bfd567",
     "rule": "B-90",
     "level": "REQUIRED",
     "status": "info",
     "severity": "info",
     "location": {